Name,Link,Bemerkungen,Attachments,Attachment Summary,Bild,Lektionsplanung
Scratch,https://scratch.mit.edu/,"Scratch ist eine kostenlose Programmiersprache und Online-Community, die speziell für Kinder und Jugendliche entwickelt wurde, um ihnen das Programmieren beizubringen. In Schulen wird Scratch häufig verwendet, um Schülern grundlegende Programmierkonzepte beizubringen, ihre Kreativität zu fördern und Problemlösungsfähigkeiten zu entwickeln. Schüler können interaktive Geschichten, Spiele und Animationen erstellen und diese mit anderen in der Scratch-Community teilen. Es ist ein wertvolles Werkzeug im Bildungsbereich, um das Interesse an Informatik und digitaler Kreativität zu wecken.",scratch-cards-all.pdf (https://v5.airtableusercontent.com/v3/u/48/48/1765540800000/_Ncm0ibhvpNd8Yhbk-1PMQ/W7DYOXNpAmQty-8jAdK5_8vWVai_L1mm_1O9EAlLVYBf4FITMJdgaCMp58-nBCxjCrGFdwLkPaOpw-YuR8Us3kQrLQoI22ff-zo0db_wA6HGkGQtjBjmTP04BHg5-O4vGrOmEGyc71CWAGlScBDbsK05NXtiWz2cIZw05CgxcrI/Xpra20B5BvBMOOh3j38sLHphGRaYMLHqfmyA1VZnxRY),,scratch-logo-png_seeklogo-489198.png (https://v5.airtableusercontent.com/v3/u/48/48/1765540800000/cuITP5o4J66PReNlephUeQ/33_Mr_vCIC9CJAMVYlhL3tiYmeZjo4Y-6Oh7OQTfkZDjy1UUSJQG9q3hfxDstbFe8hBn5vdnIg00CSnk6t86wqZobsv1FbZMa2d6mBy2KysuYPkSEKviwhPjhLIgMYOVBZ4ScM8Rt1Kha3YwrON8Nw/n5PNVgq6w18gxNfEJ6WRwOmEx5wBYY_1Q0_j08lHzHc),
Code.org,https://code.org/,"Code.org ist eine Bildungsplattform, die darauf abzielt, Schülern aller Altersgruppen den Zugang zu Informatik und Programmierung zu ermöglichen. Die Website bietet eine Vielzahl von Kursen und Projekten, die speziell für Grund-, Mittel- und Oberschulen entwickelt wurden. Zu den Angeboten gehören interaktive Labs wie das Sprite Lab, App Lab und Game Lab, die Schülern helfen, durch praktische Projekte Programmierkenntnisse zu erwerben. Ein besonderes Highlight ist die ""Hour of Code"", eine globale Initiative, die Schüler dazu ermutigt, in einer Stunde die Grundlagen der Informatik zu erlernen. Code.org unterstützt Lehrer mit Lehrplänen und Ressourcen, um Informatik in den Unterricht zu integrieren und fördert die Vielfalt in der Informatikbildung.",,,codeorg3746-4168773674.jpg (https://v5.airtableusercontent.com/v3/u/48/48/1765540800000/ZdbNeo4I9jNeLnYXEykuFw/ppic49ICALum7FaLBsOwe_DkdxU76pArRaL6f_LStqLKVr-cMhRhm7WHL-P6fkeszkkbn0XtCba05Wg4ZvBorf5aA7dymLcAlrZeZlPE_sVTyygi2_DT_l4bL31At2PXRE7KxADJxCkJLt1W3C8sFw/HSUwMV6QVje2VVL4JHm8nyudXalOUbBqoh_OECft0Qc),Lektion 1 - KI Grundlagen
Book Creator,https://bookcreator.com/,"Book Creator ist ein einfaches und inklusives Tool zur Erstellung von Inhalten im Klassenzimmer. Es ermöglicht Lehrern und Schülern, Bücher zu erstellen, zu lesen und zu veröffentlichen, und fördert die Kreativität und das Lernen. Die Plattform bietet Funktionen zur Unterstützung von Sprachlernern, zur Verbesserung der Lese- und Schreibfähigkeiten und zur Erstellung digitaler Portfolios. Sie ist für alle Altersgruppen und Fähigkeiten geeignet und wird weltweit in Schulen eingesetzt, um das Lernen zu demonstrieren und Kreativität auszudrücken.",,,1024-rounded-83288206.jpg (https://v5.airtableusercontent.com/v3/u/48/48/1765540800000/LG3hKNL3Qf7W3xKOCMlC-w/KouHHC005rIro5nwZ7V61Dcrlp0c2YnwWJW_TRsk356EZopVLjyC1lMtvomDsNS5Gik9tU1uh_X3dKlH9v3vWqhm7E9OCVT1xydg84L_5_OaVMfM_Exe35mXaeZbxKCsgRwmgyQej-v1hEr9aZtoFQ/OhLSV_rzfGbMPTr2tgKhE8d4scCqZHg-74LACLHUj6M),
Der Künstliche Intelligenz Check,https://youtu.be/Z2E85FesiiQ?si=MQGzB28ewvs6yb-T&t=193,"Ab 3:13 wird erklärt, wie künstliche Intelligenz funktioniert.",,,YouTube-Logo-2017-present-3181526239.jpg (https://v5.airtableusercontent.com/v3/u/48/48/1765540800000/5zvqaqRBpkXNbcyZZgu4pA/XKNef_QY3Q_nTSVBXCdeEzSsRpalHjaZaL2_6cwVxxKgDI-70JI7Fhh_Lh76GWPL34IQs0kuWV_Ey3OuDH6vkZS8NHqdbVWKacRLwQTdOIY9ouMwsVxoXx9aMq06IlCB474EKuUZ4NoDotjzUTg2_A/bTK2B_x0MHGoVpBJc9gehlJcFhvmAMxhXWZgwRiHRt4),Lektion 1 - KI Grundlagen
Duck AI,https://safe.duckduckgo.com/?q=DuckDuckGo+AI+Chat&ia=chat&duckai=1,"Ich kann den Inhalt der angegebenen Webseite nicht abrufen, da sie eine Weiterleitung enthält. Bitte geben Sie eine andere URL an oder beschreiben Sie den Inhalt, den Sie zusammenfassen möchten.",,,,Lektion 2 - KI Grundlagen
Thymio Studio,https://www.thymio.org/de/,,,,,Lektion 1 - Programmieren mit Thymio
PowerPoint,https://www.microsoft.com/de-ch/microsoft-365/powerpoint?market=ch,"Microsoft PowerPoint ist ein Präsentationstool, das sich ideal für den Einsatz in der Schule eignet. Es ermöglicht das einfache Erstellen ansprechender Präsentationen mit vielen Vorlagen, KI-gestützten Designvorschlägen und der Möglichkeit, handschriftliche Notizen zu digitalisieren. Besonders praktisch für den Unterricht sind Funktionen wie die Zusammenarbeit in Echtzeit, das Einfügen von Erklärvideos, der Vortragscoach mit KI-Feedback sowie barrierefreie Gestaltung. PowerPoint ist kostenlos im Web nutzbar, bietet aber im Rahmen von Microsoft 365 zusätzliche Funktionen wie mehr Speicherplatz, mobile Nutzung und KI-Features wie Copilot für die schnelle Erstellung von Präsentationen.",,,,Lektion 1 und 2 - PowerPoint Refresher für 6. Klasse
Snipping Tool,https://support.microsoft.com/de-de/windows/aufnehmen-von-screenshots-mithilfe-des-snipping-tools-00246869-1843-655f-f220-97299b865f6b,"Das Snipping Tool in Windows 10 und 11 ermöglicht es Schülern und Lehrkräften, schnell und einfach Screenshots vom gesamten Bildschirm, einzelnen Fenstern oder frei wählbaren Bereichen zu erstellen. Die Aufnahmen können direkt bearbeitet, mit Notizen versehen, gespeichert und geteilt werden. Es gibt verschiedene Aufnahmemodi (Rechteck, Freihand, Fenster, Vollbild) sowie die Möglichkeit, Videoausschnitte aufzunehmen. Praktische Tastenkombinationen erleichtern die Nutzung im Unterrichtsalltag. Mit Zusatzfunktionen wie Texterkennung (OCR) können Texte aus Screenshots extrahiert werden. Das Tool eignet sich ideal zur Dokumentation, für Präsentationen oder zur schnellen Weitergabe von Informationen im Schulkontext.",,,,Lektion 1 und 2 - PowerPoint Refresher für 6. Klasse